{
  "object_type": "intent",
  "contract_version": "0.2.0",
  "intent_id": "ap2-intent-0001",
  "created_at": "2026-08-06T12:00:00Z",
  "intent_kind": "subscribe",
  "description": "Initiate a recurring subscription purchase via AP2.",
  "principal_ref": { "ref_type": "principal", "id": "principal-ap2-user-001" },
  "subject_ref": { "ref_type": "offer", "id": "offer-ap2-recurring-001" },
  "amount_limit": { "currency_code": "EUR", "value": "9.99" },
  "native": {
    "protocol_family": "AP2",
    "protocol_version": "2.0",
    "native_object_type": "PurchaseIntent",
    "digest": {
      "algorithm": "sha-256",
      "encoding": "hex",
      "value": "0a0a0a0a0a0a0a0a0a0a0a0a0a0a0a0a0a0a0a0a0a0a0a0a0a0a0a0a0a0a0a0a"
    },
    "custody": { "disposition": "caller_retained" },
    "captured_at": "2026-08-06T12:00:00Z"
  }
}
