{
  "object_type": "intent",
  "contract_version": "0.2.0",
  "intent_id": "acp-intent-0001",
  "created_at": "2026-08-06T11:00:00Z",
  "intent_kind": "purchase",
  "description": "Authorize purchase of a subscription via ACP agent coordination.",
  "principal_ref": { "ref_type": "principal", "id": "agent-acp-buyer-001" },
  "subject_ref": { "ref_type": "offer", "id": "offer-acp-sub-001" },
  "amount_limit": { "currency_code": "USD", "value": "20.00" },
  "native": {
    "protocol_family": "ACP",
    "protocol_version": "1.0",
    "native_object_type": "AuthorizationRequest",
    "digest": {
      "algorithm": "sha-256",
      "encoding": "hex",
      "value": "d5d5d5d5d5d5d5d5d5d5d5d5d5d5d5d5d5d5d5d5d5d5d5d5d5d5d5d5d5d5d5d5"
    },
    "custody": { "disposition": "caller_retained" },
    "captured_at": "2026-08-06T11:00:00Z"
  }
}
